{
  "contract_type": "production-context",
  "schema_version": "1.0.0",
  "project_id": "synthetic-demo-001",
  "created_at": "2026-07-28T15:00:00Z",
  "governing_documents": [
    {
      "role": "master_prompt",
      "path": "Skills/MASTER_PROMPT.md",
      "sha256": "978d4e8a76dde8406e35c609c651e14b16ebd133bd398e596208ddb767c6f7fd"
    },
    {
      "role": "taste_profile",
      "path": "Skills/TASTE_PROFILE.md",
      "sha256": "2899765b6519ce26659e9fc666c37623dd760c4b79d94b0cb9b8d18b1335a12a"
    },
    {
      "role": "tool_routing",
      "path": "Skills/TOOL_ROUTING.md",
      "sha256": "5106e13d6141755afb8acdd85cfd02b25104d1ced54919fecdaa11b8bfffe6da"
    },
    {
      "role": "quality_standard",
      "path": "Skills/QUALITY_STANDARD.md",
      "sha256": "c37b18ddaa70c338eacc1644beed4feda29bc28e2b6762e6d8383bc122f4f1c2"
    },
    {
      "role": "editing_handbook",
      "path": "Skills/Video editing handbook/Elite_AI_Video_Editing_Workflow.md",
      "sha256": "50a274ea6052be49baf5b589157bbb8c45288052945c15486bd02336b94d068f"
    }
  ],
  "operating_mode": "standard",
  "artifact_type": "video_edit",
  "content_archetype": "educational_explainer",
  "deliverable": {
    "platform": "instagram_reels",
    "aspect_ratio": "9:16",
    "width_px": 1080,
    "height_px": 1920,
    "fps": 30,
    "target_duration_seconds": 35,
    "language": "en-US",
    "deadline": null
  },
  "objective": {
    "primary_goal": "Explain why timing provenance matters in AI video editing.",
    "performance_objective": "save",
    "success_definition": "Viewers understand the one-clock rule and save the reel as a workflow reference."
  },
  "audience": {
    "description": "AI creators who can generate assets but struggle to assemble coherent edits.",
    "awareness_level": "problem_aware",
    "entering_state": "They think caption drift is an isolated subtitle problem.",
    "desired_transformation": "They understand that one post-cut clock must govern captions, graphics, and review.",
    "desired_action": "Save the workflow and apply the timing contract on their next edit."
  },
  "sources": [
    {
      "source_id": "talking-head-01",
      "type": "video",
      "locator": "sources/talking-head-01.mp4",
      "accessible": true,
      "usage_rights": "owned",
      "notes": "Primary presenter take."
    },
    {
      "source_id": "timeline-diagram-01",
      "type": "image",
      "locator": "sources/timeline-diagram-01.png",
      "accessible": true,
      "usage_rights": "owned",
      "notes": "One-clock diagram."
    }
  ],
  "accessibility": {
    "captions_required": true,
    "caption_delivery": "burned_in",
    "audio_description_required": false,
    "safe_zone_profile": "instagram-reels-2026-07",
    "other_needs": [
      "Do not communicate state by color alone."
    ]
  },
  "required_evidence": [
    {
      "evidence_id": "editorial-intent-main",
      "evidence_type": "editorial_intent",
      "stage": "before-execution",
      "schema_id": "https://arete.local/editing-os/contracts/editorial-intent/v1",
      "expected_path": "contracts/editorial-intent.json",
      "required": true
    },
    {
      "evidence_id": "edl-approval-main",
      "evidence_type": "edl_approval",
      "stage": "before-final-render",
      "schema_id": "https://arete.local/editing-os/contracts/edl-approval/v1",
      "expected_path": "contracts/edl-approval.json",
      "required": true
    },
    {
      "evidence_id": "quality-report-main",
      "evidence_type": "quality_report",
      "stage": "before-final-render",
      "schema_id": "quality-report/v2",
      "expected_path": "quality/quality-report.json",
      "required": true
    }
  ]
}
